No.,ClientName,TransactionType,Category1,Description,Price,ContractType,Surface,Area,Address,FormatedLivingArea,Rooms,Baths,Ages,PriceM2,FloorId,AdministrationPrice,Neighborhood,Stratum,Garages,Extras,Latitude,Longitude,Ascesor,Depósito,ModifyDate,Link
97,YB Inmobiliaria,Venta,Apartamento,"ESPECTACULAR y AGRADABLE APARTAMENTO de 105 m²,  6 Piso con 1 ASCENSOR,   Muy ILUMINADO,  con buenos ESPACIOS,  3 Alcobas,  2 Baños,  Principal con Vestier y Baño,  Sala Comedor con Chimenea y Balcón,  Cocina Integral,  Estufa y Calentador a Gas,  2 garajes cubiertos en línea,  2 Depósitos. Salón social,  Parqueadero de Visitantes,  Bicicletero. EXCELENTE UBICACIÓN,  Barrio muy RECURSIVO,  Cerca de Cll 100,  Cll 116,  Av. Suba,  Autonorte,  rodeado de parques,  supermercados,  bancos,  almacenes,  PRECIO NEGOCIABLE.",530000000,Professional,105,105,KR 53 106 14,,3,2,9 a 15 años,5047619.05,6,638000,Pasadena,6,2,"Interiores$Balcón, Chimenea, Citófono, Cocina Integral, Depósito / Bodega, Hall de Alcobas, Instalación de gas, Zona de lavandería|Exteriores$Ascensor, Circuito cerrado de TV, En conjunto cerrado, Garaje(s), Jardín, Parqueadero Visitantes, Portería / Recepción, Salón Comunal, Vigilancia|del Sector$Colegios / Universidades, Parques cercanos, Supermercados / C.Comerciales, Trans. Público cercano, Zona Residencial",4.6951699256897,-74.06256103515629,1,True,1/29/2021 2:47:27 PM,https://www.fincaraiz.com.co/apartamento-en-venta/bogota/pasadena-det-4973901.aspx
98,Nathaly  Beltran,Venta,Apartamento,"Se vende espectacular apartamento, excelente ubicación, súper iluminado, opción de venta amoblado. 1 habitación con vestiré y baño y  opción de la segunda habitación. 1 sala comedor con video bem Cortinas eléctricas  y Black out",510000000,Particular,87,87,Calle 103 50-16,"87,00 m2",1,2,1 a 8 años,5862068.97,6,477000,Pasadena,6,2,"Interiores$Balcón, Baño Auxiliar, Barra estilo americano, Calentador, Citófono, Cocina Integral, Cocina tipo Americano, Depósito / Bodega, Estudio, Instalación de gas|Exteriores$Ascensor, Circuito cerrado de TV, En conjunto cerrado, Garaje(s), Parqueadero Visitantes, Portería / Recepción, Salón Comunal, Terraza, Vigilancia, Vivienda Multifamiliar|del Sector$Parques cercanos, Sobre vía principal, Supermercados / C.Comerciales, Trans. Público cercano, Zona Residencial",0.0,0.0,1,True,1/28/2021 11:06:30 PM,https://www.fincaraiz.com.co/apartamento-en-venta/bogota/pasadena-det-6046679.aspx
99,Al Punto,Venta,Apartamento,110 Metros cuadrados  piso 5 sin ascensor  Barrio pasadena  3 Habitaciones closet 2 Baños  Habitación de servicio con baño Cocina integral a gas Horno eléctrico Calentador a gas  Zona de lavandería  Edificio tiene  Salón comunal Plazoleta Vigilancia 24h  2 Parqueadero propios cubierto y descubierto Chimenea   Si tiene lugar estudio   Si es en conjunto cerrado   Estrato: 5  Valor administración $550.000 venta: $450000.000 arriendo: $2300.000.,450000000,Professional,110,110,calle 103 a  51 - 49,"109,00 m2",3,2,9 a 15 años,4090909.09,5,550000,Pasadena,5,2,"Interiores$Baño Auxiliar, Baño de Servicio, Calentador, Citófono, Cocina Integral, Cuarto de Servicio, Cuarto de Servicio, Depósito / Bodega, Estudio, Instalación de gas, Piso en Baldosa /  Mármol, Zona de lavandería|Exteriores$Garaje(s), Parqueadero Visitantes, Portería / Recepción, Vigilancia, Zonas Verdes",4.69141530990601,-74.0623016357422,0,True,2/12/2021 12:52:57 AM,https://www.fincaraiz.com.co/apartamento-en-venta/bogota/pasadena-det-6089223.aspx
100,Tu Lugar Ideal,Venta,Apartamento,"Código 1249: Tu Lugar Ideal trae espectacular apartamento con 3 alcobas amplias,  la principal con baño y vestier,  1 parqueadero cubierto y parqueaderos de visitantes,  salón comunal,  un área de 99 Mt2 zona de alta valorización,  libre de deuda,  vigilacia 24/7,  chimenea a gas u energía,  divisiones en vidrio,  habitación principal con balcón,  vista exterior,  re-modelado,  iluminación natural,  sala y comedor amplias. Agenda ya,  disponibilidad inmediata .",475000000,Professional,99,99,Av Carrera 54 # 107A - 10,"99,00 m2",3,2,9 a 15 años,4797979.8,2,520000,Pasadena,2,1,"Interiores$Balcón, Cableado de Red, Chimenea, Citófono, Closet, Cocina Integral, Cocina tipo Americano, Depósito / Bodega, Despensa, Hall de Alcobas, Shut de basura|Exteriores$Ascensor, Circuito cerrado de TV, En conjunto cerrado, Portería / Vigilancia, Salón Comunal, Vigilancia privada 24*7|del Sector$Colegios / Universidades, Cómodas vias de acceso, Parques cercanos, Sobre vía secundaria, Supermercados / C.Comerciales, Trans. Público cercano, Zona Residencial",4.69700002670288,-74.06300354003909,1,True,1/27/2021 10:58:12 PM,https://www.fincaraiz.com.co/apartamento-en-venta/bogota/pasadena-det-5158192.aspx
101,Homes n Bricks,Venta,Apartamento,"Encuentra,  Arrienda o Vende con nosotros. Siempre más opciones en www.homesnbricks.com Visitanos!!  El apartamento cuenta con 3 habitaciones,  la principal con baño en suite y walk-in closet. Dos habitaciones comparten baño y hay un baño social. La sala y el comedor se encuentran en ambientes separados. En la sala hay una chimenea de leña. El piso de las áreas sociales es de madera,  y el de las habitaciones laminado. El apartamento tiene vista hacia una zona verde,  a pesar de ser interior.  La cocina tiene estufa a gas y el horno es eléctrico. Tiene cuarto y baño de servicio,  2 garajes en línea y depósito.   El edifico se compone de dos torres independientes,  tiene una terraza común al aire libre,  ubicada en el primer piso. Cuenta con vigilancia 24 horas y circuito cerrado de televisión. Existe la facilidad de acceso por múltiples vías y la cercanía de transmilenio,  supermercados y parques.    .",600000000,Professional,118,118,"carrera 53 No. 104 B - 48, apto 207","113,00 m2",3,3,16 a 30 años,5084745.76,2,500000,Pasadena,2,2,"Interiores$Baño Auxiliar, Baño Independiente, Calentador, Chimenea, Citófono, Closet, Cocina Equipada, Cocina Integral, Cuarto de Servicio, Depósito / Bodega, Instalación de gas, Zona de lavandería|Exteriores$Acceso Pavimentado, Ascensor, Circuito cerrado de TV, Garaje / Parqueadero(s), Garaje(s), Parqueadero Visitantes, Portería / Recepción, Salón Comunal, Terraza, Vigilancia|del Sector$Colegios / Universidades, Parques cercanos, Supermercados / C.Comerciales, Trans. Público cercano, Zona Residencial",4.69330072402954,-74.0621566772461,1,True,2/12/2021 4:14:34 PM,https://www.fincaraiz.com.co/apartamento-en-venta/bogota/pasadena-det-6041120.aspx
102,Lida Perez,Venta,Apartamento,Hermoso apartamento interior bien iluminado 2 habitaciones Estudio Balcón 3 baños 2 parqueaderos independientes Deposito Edificio tiene Gimnasio y terraza Antiguedad 5 años Estrato 5 Excelente ubicación en el sector hay bancos restaurantes comercio en general,565000000,Particular,94,94,Carrera 51  102A 63 Apto 403,"94,00 m2",2,3,1 a 8 años,6010638.3,4,739000,Pasadena,4,2,"Interiores$Balcón, Depósito / Bodega, Estudio|Exteriores$Gimnasio, Terraza, Vigilancia|del Sector$Parques cercanos, Supermercados / C.Comerciales, Zona Residencial",4.69098377227783,-74.06207275390629,0,True,2/15/2021 6:44:45 PM,https://www.fincaraiz.com.co/apartamento-en-venta/bogota/pasadena-det-6041518.aspx
103,CARLOS RAMIREZ,Venta,Apartamento,"Hermoso apartamento ubicado en una de las mejores zonas residenciales de Bogotá (Pasadena). Cuenta con una excelente distribución con Cocina Integral moderna y bien equipada, zona de lavandería independiente, sala comedor, dos habitaciones con excelente espacio y dos baños. Cuenta con 2 parqueaderos en línea y 1 deposito amplio.",450000000,Particular,71,71,Cra 49B 105-21,"66,00 m2",2,2,1 a 8 años,6338028.17,2,550000,Pasadena,2,2,"Interiores$Barra estilo americano, Calentador, Citófono, Cocina Integral, Cocina tipo Americano, Depósito / Bodega, Zona de lavandería|Exteriores$Ascensor, Circuito cerrado de TV, Garaje(s), Parqueadero Visitantes, Portería / Recepción, Salón Comunal, Terraza, Vigilancia|del Sector$Parques cercanos, Supermercados / C.Comerciales, Trans. Público cercano, Zona Residencial|#Apartamento#$Loft",4.69410991668701,-74.0601577758789,1,True,2/1/2021 7:40:44 PM,https://www.fincaraiz.com.co/apartamento-en-venta/bogota/pasadena-det-6039155.aspx
104,Angela Adriana  Gomez Arenas,Venta,Apartamento,"Excelente ubicación, junto a parque, sala comedor con chimenea, piso en madera maciza, 2 alcobas, ppal con baño privado, segunda alcoba con baño en hall de alcobas, cocina tipo americano, zona de lavandería, calentador a gas, 1 garaje cubierto, buenas vías de acceso, rodeado de parques, zona comercial muy cerca",290000000,Particular,54,54,Carrera 52  106-20,"54,00 m2",2,2,16 a 30 años,5370370.37,4,440000,Pasadena,4,1,"Interiores$Calentador, Chimenea, Citófono, Cocina Integral, Cocina tipo Americano, Instalación de gas, Zona de lavandería|Exteriores$Ascensor, Circuito cerrado de TV, En conjunto cerrado, Portería / Recepción, Salón Comunal, Vigilancia|del Sector$Colegios / Universidades, Parques cercanos, Supermercados / C.Comerciales, Trans. Público cercano, Zona Residencial",4.694739818573,-74.0615768432617,1,False,2/8/2021 3:36:28 PM,https://www.fincaraiz.com.co/apartamento-en-venta/bogota/pasadena-det-6039153.aspx
105,Remax Focus,Venta,Apartamento,"VENDO APARTAMENTO DE 116M2 EN ESTORIL / PASADENA . CONSTA DE 3ALCOBAS ,  2 BAÑOS ,  BAÑO SOCIAL,  CUARTO Y BAÑO DE SERVICIO,  AREA SOCIAL CON CHIMENEA,  COMEDOR,  COCINA INTEGRAL CON ESTUFA MIXTA,  HORNO ELECTRICO,  ZONA DE LAVANDERIA Y CALENTADOR A GAS. ESPACIOS AMPLIOS Y CON VENTANALES QUE FAVORECEN LA ENTRADA DE LUZ Y VENTILACION. PISOS EN MARMOL Y LAMINADO. CUENTA CON 2 PARQUEADEROS INDEPENDIENTES Y DEPOSITO. EL EDIFICIO ESTA AUTOMATIZADO,  TIENEN INGRESO A PARQUEADEROS CON PUERTA ELECTRICA TEMPORIZADA,  INGRESO POR LA PUERTA DEL EDIFICIO CON LLAVE Y CLAVE,  ADEMAS CUENTA VIDEO PORTERO,  ASCENSOR,  CAMARAS DE SEGURIDAD Y VIGILANCIA DE 9 HORAS AL DIA DE LUNES A VIERNES.   VALOR ADMINISTRACION SIN DESCUENTO $468.0000 BUENA UBICACIÓN! EXCELENTE OPORTUNIDAD!.",510000000,Professional,116,116,Carrera 47 # 106A - 65,"116,00 m2",3,3,Más de 30 años,4396551.72,0,468000,Pasadena,0,2,,4.69500017166138,-74.05799865722659,0,False,2/13/2021 4:00:36 PM,https://www.fincaraiz.com.co/apartamento-en-venta/bogota/pasadena-det-6093525.aspx
106,Gran Urbe Inmobiliaria,Venta,Apartamento,"Bellísimo apartamento de 78 mts2. en privilegiada ubicación de Pasadena. Este magnífico espacio cuenta con 2 habitaciones y 2 baños (la principal con baño privado),  sala-comedor,  cocina integral cerrada en línea,  espacio independiente para torre de lavadora/secadora y 1 parqueadero. Apartamento con muy buena distribución,  iluminación y en buen estado..",327000000,Professional,78,78,Calle 103 B  51 - 41,"78,00 m2",2,2,16 a 30 años,4192307.69,5,420000,Pasadena,5,1,"Interiores$Calentador, Citófono, Cocina Integral, Estudio, Instalación de gas, Piso en Baldosa /  Mármol, Zona de lavandería|Exteriores$Ascensor, Circuito cerrado de TV, Parqueadero Visitantes, Portería / Recepción, Salón Comunal, Vigilancia|del Sector$Parques cercanos, Sobre vía principal, Supermercados / C.Comerciales, Trans. Público cercano, Zona Comercial, Zona Residencial",4.69159269332886,-74.06298828125,1,False,1/26/2021 12:57:44 PM,https://www.fincaraiz.com.co/apartamento-en-venta/bogota/pasadena-det-4874700.aspx
107,Gran Urbe Inmobiliaria,Venta,Apartamento,"Bellísimo apartamento de 52 mts2. en Pasadena. Este magnífico espacio cuenta con 2 habitaciones y 2 baños (la principal con baño privado y walking closet),  sala-comedor con balcón,  cocina integral abierta y espacio independiente para torre de lavadora/secadora. 1 Parqueadero. Este apartamento cuenta con muy buena distribución e iluminación,  además de estar en un excelente estado..",335000000,Professional,52,52,Calle 106 B  54 - 27,"52,00 m2",2,2,1 a 8 años,6442307.69,2,405000,Pasadena,2,1,"Interiores$Balcón, Barra estilo americano, Calentador, Citófono, Cocina Integral, Cocina tipo Americano, Instalación de gas, Piso en Baldosa /  Mármol, Zona de lavandería|Exteriores$Ascensor, Circuito cerrado de TV, Parqueadero Visitantes, Portería / Recepción, Salón Comunal, Vigilancia|del Sector$Colegios / Universidades, Parques cercanos, Supermercados / C.Comerciales, Trans. Público cercano, Zona Residencial",4.69591999053955,-74.0638732910156,1,False,1/26/2021 12:57:22 PM,https://www.fincaraiz.com.co/apartamento-en-venta/bogota/pasadena-det-5327362.aspx
108,Gran Urbe Inmobiliaria,Venta,Apartamento,"Moderno apartamento para estrenar de 65 mts2 en Pasadena. El espacio cuenta con 2 habitaciones y 3 baños (las dos habitaciones tienen baño privado y closet),  sala  comedor con chimenea,  cocina abierta con mesón tipo americano,  zona de ropas independiente y balcón pequeño. Piso laminado en zonas sociales y habitaciones y porcelanato en cocina,  baños y lavandería. Espacio para pequeño estudio y hall de entrada; 2 Parqueaderos cubiertos y 1 depósito. Edificio terraza,  golfito,  vigilancia 24 hrs..",430000000,Professional,65,65,Carrera 51  102,"65,00 m2",2,3,1 a 8 años,6615384.62,2,245000,Pasadena,2,2,"Interiores$Baño Auxiliar, Barra estilo americano, Calentador, Chimenea, Citófono, Cocina Integral, Cocina tipo Americano, Depósito / Bodega, Estudio, Hall de Alcobas, Instalación de gas, Piso en Baldosa /  Mármol, Zona de lavandería|Exteriores$Ascensor, Circuito cerrado de TV, Parqueadero Visitantes, Portería / Recepción, Salón Comunal, Terraza, Vigilancia|del Sector$Colegios / Universidades, Parques cercanos, Supermercados / C.Comerciales, Trans. Público cercano, Zona Comercial, Zona Residencial",4.69343614578247,-74.0608444213867,1,True,1/26/2021 12:57:19 PM,https://www.fincaraiz.com.co/apartamento-en-venta/bogota/pasadena-det-5673368.aspx
109,Gran Urbe Inmobiliaria,Venta,Apartamento,"Fabuloso apartamento de 100 mts2 en privilegiada ubicación de Pasadena. El espacio cuenta con 3 habitaciones (Ppal con vestier y baño) 3 baños,  sala  comedor,  amplia cocina con mesón tipo americano,  zona de lavandería ind/ente y 2 balcones (1 en habitación ppal) El espacio cuenta con 2 parqueaderos cubiertos en línea,  depósito,  encortinado,  piso laminado,  una excelente iluminación y ventilación,  y buenas vías de acceso. El edificio tiene ascensor,  salón de eventos,  gym pequeño y vigilancia 24h.",600000000,Professional,100,100,Carrera 53  103,"100,00 m2",3,3,1 a 8 años,6000000.0,2,484000,Pasadena,2,2,"Interiores$Balcón, Barra estilo americano, Calentador, Citófono, Cocina Integral, Cocina tipo Americano, Depósito / Bodega, Hall de Alcobas, Instalación de gas, Piso en Baldosa /  Mármol, Zona de lavandería|Exteriores$Ascensor, Circuito cerrado de TV, Parqueadero Visitantes, Portería / Recepción, Salón Comunal, Terraza, Vigilancia, Vista panorámica|del Sector$Colegios / Universidades, Parques cercanos, Sobre vía principal, Supermercados / C.Comerciales, Trans. Público cercano, Zona Comercial, Zona Residencial",4.69555330276489,-74.06227111816409,1,True,1/26/2021 12:52:25 PM,https://www.fincaraiz.com.co/apartamento-en-venta/bogota/pasadena-det-5977249.aspx
110,Gran Urbe Inmobiliaria,Venta,Apartamento,"Acogedor apartamento de 84, 6 mts2. en Pasadena. El espacio es exterior y muy iluminado. Cuenta con 2 habitaciones con closet y 3 baños (habitaciones con baños privados  principal con walking closet) sala  comedor con balcón,  cocina integral estilo americano y zona para nevecón y torre de lavadora y secadora. Piso laminado; Ascensor,  2 parqueaderos independientes y depósito..",535000000,Professional,84,84,Carrera 51  102 a,"85,00 m2",2,3,1 a 8 años,6323877.07,3,688000,Pasadena,3,2,"Interiores$Balcón, Barra estilo americano, Calentador, Citófono, Cocina Integral, Cocina tipo Americano, Depósito / Bodega, Instalación de gas|Exteriores$Ascensor, Circuito cerrado de TV, Parqueadero Visitantes, Portería / Recepción, Salón Comunal, Vigilancia|del Sector$Colegios / Universidades, Parques cercanos, Sobre vía principal, Supermercados / C.Comerciales, Trans. Público cercano, Zona Residencial",4.69119882583618,-74.0610122680664,1,True,1/26/2021 12:52:14 PM,https://www.fincaraiz.com.co/apartamento-en-venta/bogota/pasadena-det-5977437.aspx
111,RAFAEL DIAZ,Venta,Apartamento,"Apartamento duplex,  exterior,  muy iluminado,  cuenta con 3 habitaciones,  2 baños,  estudio,  terraza (6 mts),  2 parqueaderos y depósito.   Acutalmente se encuentra arrendado,  excelente oportunidad para invertir. .",450000000,Professional,110,110,Carrera 50 # 103B-33,"110,00 m2",3,2,16 a 30 años,4090909.09,5,677000,Pasadena,5,2,"Interiores$Baño Independiente, Calentador, Chimenea, Cocina Integral, Depósito / Bodega, Instalación de gas, Zona de lavandería|Exteriores$Acceso Pavimentado, Ascensor, Circuito cerrado de TV, Portería / Recepción, Salón Comunal, Vigilancia, Vista panorámica|del Sector$Zona Residencial",4.69203329086304,-74.0613632202148,1,True,1/25/2021 2:50:15 PM,https://www.fincaraiz.com.co/apartamento-en-venta/bogota/pasadena-det-5721191.aspx
112,Rentahouse Colombia SAS,Venta,Apartamento,"Este apartamento te brinda espacios amplios,  iluminados y cómodos. Los días de sol iluminaran tu sala durante las tardes y podrás acercarte al balcón para disfrutar el calor que te ofrece. La cocina es cómoda,  abierta,  totalmente equipada y con acabados de calidad,  herrajes importados de cierre lento y campana extractora de acero inoxidable cocinar en ella será un placer. Las habitaciones           Deposito, Gimnasio, Vigilancia Privada                                    Apartamento Interior.",559000000,Professional,84,84,"Pasadena,Bogota,Bogota D.C.",,2,3,9 a 15 años,6654761.9,5,416000,Pasadena,5,2,"Interiores$Calentador, Citófono, Cocina Integral, Hall de Alcobas, Instalación de gas, Zona de lavandería|Exteriores$Ascensor, Circuito cerrado de TV, En conjunto cerrado, Garaje(s), Jardín, Portería / Recepción, Vigilancia, Vista panorámica|del Sector$Colegios / Universidades, Parques cercanos, Sobre vía principal, Supermercados / C.Comerciales, Trans. Público cercano, Zona Comercial, Zona Residencial",4.68987512588501,-74.061279296875,1,False,1/24/2021 4:03:25 PM,https://www.fincaraiz.com.co/apartamento-en-venta/bogota/pasadena-det-5676907.aspx
113,valeria  luque,Venta,Apartamento,Increíble duplex remodelado y moderno En el primer piso se encuentra zona de comedor una terraza a la entrada la sala baño de invitados y una terraza al fondo perfecta para hacer una zona bbq la cocina y zona de lavado En el segundo piso se encuentran dos cuartos el cuarto principal con un baño amplio y una terraza el otro cuarto es sencillo Un apto iluminado tranquilo y amplio perfecto para parejas o personas que quieran vivir solas Sin parqueadero precio negociable,290000000,Particular,51,51,cra 53 #103b-80,"51,00 m2",2,2,9 a 15 años,5686274.51,0,250000,Pasadena,0,0,"Interiores$Balcón, Calentador, Citófono|Exteriores$Ascensor, Parqueadero Visitantes, Portería / Recepción|del Sector$Parques cercanos, Sobre vía principal, Supermercados / C.Comerciales, Trans. Público cercano|#Apartamento#$Duplex",4.69270706176758,-74.062370300293,1,False,2/6/2021 6:00:29 PM,https://www.fincaraiz.com.co/apartamento-en-venta/bogota/pasadena-det-6032876.aspx
114,Inboni Inmobiliaria,Venta,Apartamento,"Apartamento para la venta en Pasadena,  57 M2,  2 habitaciones,  estudio,  2 baños,  cocina abierta remodelada,  2 parqueaderos en linea,  quinto piso,  iluminado,  8 años de construido,  espacios abiertos y modernos,  edificio con vigilancia 24 horas,  ascensor,  terraza social,  sobre carrera,  excelente ubicación,  cerca a Transmilenio de la Autonorte y Av Suba,  zona residencial con comercios cercanos,  precio de mercado..",339000000,Professional,57,57,Carrera 51 # 102A - 75,"57,00 m2",2,2,1 a 8 años,5947368.42,5,400000,Pasadena,5,2,"Interiores$Citófono, Shut de basura|Exteriores$Garaje Cubierto, Portería / Vigilancia|del Sector$Cómodas vias de acceso, Sobre vía secundaria",4.69299983978271,-74.06199645996091,0,False,1/22/2021 1:13:12 AM,https://www.fincaraiz.com.co/apartamento-en-venta/bogota/pasadena-det-5343251.aspx
115,JAIRO BASTIDAS,Venta,Apartamento,"venta de apartamento en pasadena, excelente zona tranquila y residencial, cuenta con sala comedor cocina una alcoba un baño parqueadero.",235000000,Particular,38,38,carrera 51 102a 75,,1,1,1 a 8 años,6184210.53,5,280000,Pasadena,5,1,"Interiores$Alarma, Barra estilo americano, Calentador, Citófono, Cocina tipo Americano, Hall de Alcobas, Instalación de gas, Zona de lavandería|Exteriores$Ascensor, Circuito cerrado de TV, En conjunto cerrado, Garaje(s), Parqueadero Visitantes, Portería / Recepción, Salón Comunal, Vigilancia",4.69109010696411,-74.0620498657227,1,False,1/22/2021 6:29:12 AM,https://www.fincaraiz.com.co/apartamento-en-venta/bogota/pasadena-det-6027443.aspx
116,Rentahouse Colombia SAS,Venta,Apartamento,"Quieres un hogar tranquilo,  en un lindo barrio residencial con excelente ubicación,  Este apartamento es para ti. Inversión garantizada,  te ofrece amplios espacios con delicados acabados,  listo para habitarlo y disfrutarlo. Su ubicación cercana a Av 100,  Av 116,  Auopista Norte,  y Avenida Suba,  te brindan facilidad de acceso y desplazamiento.           Chimenea, Vigilancia Privada                                    Apartamento Interior.",320000000,Professional,64,64,"Pasadena,Bogota,Bogota D.C.",,2,1,Más de 30 años,5000000.0,2,371200,Pasadena,2,1,"Interiores$Baño Auxiliar, Calentador, Chimenea, Citófono, Cocina Integral, Hall de Alcobas, Instalación de gas, Piso en Baldosa /  Mármol, Zona de lavandería|Exteriores$Ascensor, Circuito cerrado de TV, En conjunto cerrado, Garaje(s), Jardín, Parqueadero Visitantes, Portería / Recepción, Vigilancia|del Sector$Colegios / Universidades, Parques cercanos, Sobre vía principal, Supermercados / C.Comerciales, Trans. Público cercano, Zona Comercial, Zona Residencial",4.67395305633545,-74.0869903564453,1,False,1/21/2021 8:49:18 PM,https://www.fincaraiz.com.co/apartamento-en-venta/bogota/pasadena-det-5791517.aspx
117,Mision Inmobiliaria & Zulma Sandoval Fincaraiz,Venta,Apartamento,"ZS-768 Hermoso apartamento esquinero con excelente iluminación para estrenar,  entrega inmediata. 3 habitaciones principal con baño privado,  zona social en un solo ambiente con chimenea a gas y balcon,  baño social,  cocina abierta,  2 parqueaderos y deposito. Edificio con  lobby,  salón de entretenimiento,  salón de reuniones,  salón de juegos infantiles,  gym,  terraza con Bbq,  terraza con parque infantil,  2 accesos vehiculares y un acceso peatonal,  12 parqueaderos de visitantes,  caldera. .",868000000,Professional,125,125,calle 104A # 47A-14,"125,00 m2",3,3,1 a 8 años,6944000.0,3,0,Pasadena,3,2,"Interiores$Balcón, Baño Auxiliar, Baño Independiente, Calentador, Chimenea, Citófono, Closet, Cocina Equipada, Cocina Integral, Depósito / Bodega, Zona de lavandería|Exteriores$Acceso Pavimentado, Asador, Ascensor, Canchas Deportivas, Circuito cerrado de TV, Cochera, En conjunto cerrado, Garaje / Parqueadero(s), Garaje(s), Gimnasio, Parqueadero Visitantes, Portería / Recepción, Salón Comunal, Terraza, Vigilancia, Vista panorámica, Vivienda Multifamiliar, Zona Infantil, Zonas Verdes|del Sector$Colegios / Universidades, Parques cercanos, Supermercados / C.Comerciales, Trans. Público cercano, Zona Residencial",4.692348957061769,-74.0589828491211,1,True,1/21/2021 6:06:18 PM,https://www.fincaraiz.com.co/apartamento-en-venta/bogota/pasadena-det-5474332.aspx
118,Mision Inmobiliaria & Zulma Sandoval Fincaraiz,Venta,Apartamento,"ZS-768 Lindo y esquinero con excelente iluminación para estrenar,  entrega inmediata. 3 habitaciones principal con baño privado,  zona social en un solo ambiente con chimenea a gas y balcon,  baño social,  cocina abierta,  2 parqueaderos y deposito. Edificio con  lobby,  salón de entretenimiento,  salón de reuniones,  salón de juegos infantiles,  gym,  terraza con Bbq,  terraza con parque infantil,  2 accesos vehiculares y un acceso peatonal,  12 parqueaderos de visitantes,  caldera,  .",868000000,Professional,125,125,calle 104A # 47A-14,"125,00 m2",3,3,1 a 8 años,6944000.0,3,0,Pasadena,3,2,"Interiores$Balcón, Baño Auxiliar, Baño Independiente, Calentador, Chimenea, Citófono, Closet, Cocina Equipada, Cocina Integral, Depósito / Bodega, Zona de lavandería|Exteriores$Acceso Pavimentado, Asador, Ascensor, Canchas Deportivas, Circuito cerrado de TV, Cochera, En conjunto cerrado, Garaje / Parqueadero(s), Garaje(s), Gimnasio, Parqueadero Visitantes, Portería / Recepción, Salón Comunal, Terraza, Vigilancia, Vista panorámica, Vivienda Multifamiliar, Zona Infantil, Zonas Verdes|del Sector$Colegios / Universidades, Parques cercanos, Supermercados / C.Comerciales, Trans. Público cercano, Zona Residencial",4.692348957061769,-74.0589828491211,1,True,1/21/2021 6:05:56 PM,https://www.fincaraiz.com.co/apartamento-en-venta/bogota/pasadena-det-5344506.aspx
