No.,ClientName,TransactionType,Category1,Description,Price,ContractType,Surface,Area,Address,FormatedLivingArea,Rooms,Baths,Ages,PriceM2,FloorId,AdministrationPrice,Neighborhood,Stratum,Garages,Extras,Latitude,Longitude,Ascesor,Depósito,ModifyDate,Link
241,L2L Bienes Raíces SAS,Venta,Apartamento,"VENDO APARTAMENTO DÚPLEX EN PASADENA.  PRECIO NEGOCIABLE POR  CAMBIO DE CIUDAD!.  SIN ASCENSOR. 97 mts. y terraza de 4 mts.  en habitación principal. Se encuentra en cuarto piso de edificio,  con vista interior y buen aporte de luz natural.  Ofrece un cálido estilo con pisos remodelados,  en el primer nivel encuentra sala comedor con chimenea,  cocina integral,  cuarto de servicio con baño,  zona de ropas independiente  y una habitación,  cuatro baños completos incluido el de área social.  En segundo nivel área  para estudio,  dos confortables habitaciones cada una con su baño,  la principal con tina.  Cuenta con depósito y un parqueadero cubierto.  Está ubicado en un zona residencial,  cercano a zonas verdes y recreativas,  Centro Comercial Iserra 100,  supermercados y almacenes de cadena,  excelentes servicios circundantes,  transporte masivo y fácil movilidad por calle 100,  avda. Suba,  calle 116,  carrera 53,  Autopista Norte..",395000000,Professional,97,97,Carrera 52 # 106 - 33,"97,00 m2",3,4,16 a 30 años,4072164.95,0,447000,Pasadena,0,1,"Interiores$Baño Auxiliar, Chimenea, Citófono, Closet, Cocina Integral, Cuarto de Servicio, Depósito / Bodega, Escalera de Emergencia, Instalación de gas, Piso en Baldosa /  Mármol, Piso en Madera|Exteriores$Garaje / Parqueadero(s), Garaje Cubierto, Portería / Vigilancia, Terraza, Vigilancia privada 24*7|del Sector$Cómodas vias de acceso, Parques cercanos, Restaurantes, Sobre vía secundaria, Supermercados / C.Comerciales, Trans. Público cercano, Zona Residencial|#Apartamento#$Duplex",4.69000005722046,-74.05999755859379,0,True,2/15/2021 8:13:29 PM,https://www.fincaraiz.com.co/apartamento-en-venta/bogota/pasadena-det-5777148.aspx
242,Imsa Ltda,Venta,Apartamento,"Lindo ato en Pasadena,  5 piso,  138 mts,  4 habitaciones,  5 baño,  sala comedor,  estudio,  2 parqueadero,  salón social,  terraza de BBQ,  6 años de construido,  excelente vías de acceso,  excelente ubicacion..",705000000,Professional,138,138,CALLE 102 No 51 15,"138,00 m2",4,5,1 a 8 años,5108695.65,5,850000,Pasadena,5,2,"Interiores$Citófono, Cocina Integral, Depósito / Bodega, Hall de Alcobas, Zona de lavandería|Exteriores$Ascensor, Circuito cerrado de TV, En conjunto cerrado, Garaje(s), Parqueadero Visitantes, Portería / Recepción, Salón Comunal, Vivienda Multifamiliar|del Sector$Colegios / Universidades, Parques cercanos, Supermercados / C.Comerciales, Trans. Público cercano, Zona Residencial",4.6899151802063,-74.0623321533203,1,True,1/19/2021 6:19:59 PM,https://www.fincaraiz.com.co/apartamento-en-venta/bogota/pasadena-det-5852937.aspx
243,Bogotá Real Estate,Venta,Apartamento,"Vendo apto en pasadena 130metros,  duplex,  penthouse,  pisos en madera laminada,  dos terrazas,  2 parqueaderos,  depósito,  chimenea,  cocina integral,  zona de ropas. Cerca a los 3 elefantes,  romi,  2 parques cercanos,  cerca a transmilenio. cerca  a la avenida suba,  autopista ,  calle 100,  iserra 100. en el norte de  Bogotá,  lindo,  apartamento bien iluminado con excelente vista,  cerca a la zona bancaria y almacenes de cadena,  sito de excelente valorizaron,  cerca a grandes almacenes de cadena,  bancos y...",700000000,Professional,130,130,Cra 53  103b -80,"155,00 m2",3,3,16 a 30 años,5384615.38,7,340000,Pasadena,7,2,"Interiores$Alarma, Balcón, Baño Auxiliar, Barra estilo americano, Calentador, Chimenea, Citófono, Cocina Integral, Cocina tipo Americano, Cuarto de Servicio, Depósito / Bodega, Estudio, Hall de Alcobas, Instalación de gas, Patio, Piso en Baldosa /  Mármol, Zona de lavandería|Exteriores$Ascensor, Circuito cerrado de TV, En conjunto cerrado, Garaje(s), Jardín, Parqueadero Visitantes, Portería / Recepción, Salón Comunal, Terraza, Vigilancia, Vista panorámica, Vivienda Bifamiliar, Vivienda Multifamiliar, Zona Infantil, Zonas Verdes|del Sector$Colegios / Universidades, Parques cercanos, Sobre vía principal, Supermercados / C.Comerciales, Trans. Público cercano, Zona Comercial, Zona Industrial, Zona Residencial|#Apartamento#$Duplex, PentHouse",0.0,0.0,1,True,1/12/2021 4:49:17 PM,https://www.fincaraiz.com.co/apartamento-en-venta/bogota/pasadena-det-4106557.aspx
244,Luis Soto y CIA S.A,Venta,Apartamento,"Apartamento duplex con excelente ubicación,  buenas vías de acceso,  cerca a  parques,  iglesias,  centro comercial Isierra 100,  estación de transmilenio,  restaurantes,  bancos,  supermercados,  D1,  Carulla,  Ara. Ubicado en segundo piso interior con buena iluminación y distribución. En el primer piso esta la sala comedor con chimenea ,  cocina integral a gas,  zona de lavandería integrada,  calentador a gas,  balcón y baño social. En el segundo piso  tres habitaciones, y dos baños. Depósito y dos parqueaderos en linea cubiertos. No tiene ascensor. El edificio cuenta con salón comunal,  zona de niños,  parqueaderos para visitantes  y vigilancia 24 horas..",500000000,Professional,119,119,Carrera 52 # 106 - 83 Apto 204 B Edificio Pasadena Royal,"119,00 m2",3,2,16 a 30 años,4201680.67,0,480000,Pasadena,0,2,"Interiores$Balcón, Baño Auxiliar, Citófono, Closet, Cocina Integral, Depósito / Bodega, Instalación de gas|Exteriores$En conjunto cerrado, Parqueadero Visitantes, Portería / Vigilancia, Salón Comunal, Vigilancia privada 24*7, Zona Infantil|del Sector$Cómodas vias de acceso, Parques cercanos, Supermercados / C.Comerciales, Trans. Público cercano, Zona Residencial",4.69600009918213,-74.06199645996091,0,True,2/3/2021 1:55:05 PM,https://www.fincaraiz.com.co/apartamento-en-venta/bogota/pasadena-det-5970862.aspx
245,Yolima  Ortega,Venta,Apartamento,Hermoso apartamento segundo piso exterior iluminación natural dos balcones acabados modernos Zona tranquila y residencial vía secundaria Vías cercanas calle 100 av suba calle 116 y auto norte,610000000,Particular,100,100,53 106,"100,00 m2",3,3,1 a 8 años,6100000.0,0,484000,Pasadena,0,2,,4.69563388824463,-74.0625305175781,0,False,2/3/2021 10:02:14 PM,https://www.fincaraiz.com.co/apartamento-en-venta/bogota/pasadena-det-4865719.aspx
246,Inboni Inmobiliaria,Venta,Apartamento,"Venta apartamento tres alcobas en Pasadena. Moderno apartamento nuevo,  extraordinarios acabados. Exterior,  agradable vista a parque. Sala y comedor en un ambiente,  chimenea a gas,  balcón de gran tamaño,  moderna cocina abierta con mesón,  baño social,  zona de lavandería independiente,  closet de linos,  estar de alcobas,  alcoba principal con vestier y baño privado,  alcobas dos y tres con closets de piso a techo,  comparten un baño completo. Pisos en madera. Dos garajes en línea,  depósito. El edificio cuenta con CCTV,  terraza Sky bbq con vista 360,  dos terrazas con juegos para niños,  salón social,  salón de juegos para niños,  gimnasio dotado,  teatro,  parqueaderos de visitantes,  dos ascensores última generación,  planta eléctrica. Excelente ubicación,  rodeado de parques,  fáciles vías de acceso,  cerca a zonas de comercio..",888000000,Professional,126,126,Calle 104A # 47A - 06,"113,00 m2",3,2,1 a 8 años,7047619.05,3,689000,Pasadena,3,2,"Interiores$Balcón, Baño Auxiliar, Cableado de Red, Chimenea, Citófono, Closet, Cocina Integral, Cocina tipo Americano, Comedor auxiliar, Depósito / Bodega, Escalera de Emergencia, Instalación de gas, Servicios independientes, Shut de basura, Zona de BBQ|Exteriores$Ascensor(es) inteligente(s), Auditorio, Bahía exterior de parqueo, Circuito cerrado de TV, Garaje Cubierto, Gimnasio, Parqueadero Visitantes, Planta Eléctrica, Portería / Vigilancia, Salón Comunal, Salón de Juegos, Salón de videoconferencias, Tanques de Agua, Vigilancia privada 24*7, Zona Infantil|del Sector$Área Urbana, Bombas de gasolina, Cómodas vias de acceso, Parques cercanos, Sobre vía secundaria, Supermercados / C.Comerciales, Trans. Público cercano, Zona Residencial",4.69199991226196,-74.0589981079102,1,True,1/22/2021 1:10:16 AM,https://www.fincaraiz.com.co/apartamento-en-venta/bogota/pasadena-det-5969560.aspx
247,Marta Luz  Mora Restrepo,Venta,Apartamento,"Excelente y cómodo Apto duplex . En el primer piso, sala comedor ,chimenea, baño social cocina .Segundo piso: Habitación principal con baño con amplio tina y luz natural y balcón . Segunda habitación con altillo que puede funcionar como tercera habitación. Hall de alcobas, baño con ducha.  Entapetado, Calientico,  Cuarto de ropas o linos,  2 Garajes Por ser duplex la zona social es muy independiente de la zona de alcobas.  Muy iluminado Vista al oriente.",405000000,Particular,82,82,Carrera 50  102-38 Apto 507,"82,00 m2",2,3,16 a 30 años,4939024.39,5,0,Pasadena,5,2,"Interiores$Balcón, Baño Auxiliar, Calentador, Chimenea, Citófono, Hall de Alcobas, Instalación de gas|Exteriores$Ascensor, Portería / Recepción, Salón Comunal, Vigilancia|del Sector$Parques cercanos, Supermercados / C.Comerciales, Trans. Público cercano, Zona Residencial|#Apartamento#$Duplex",4.69123315811157,-74.06080627441409,1,False,1/25/2021 6:53:11 PM,https://www.fincaraiz.com.co/apartamento-en-venta/bogota/pasadena-det-5840054.aspx
248,Ligia Jacome Jacome,Venta,Apartamento,"Espectacular apartamento de 122 mts con 3 habitaciones amplias, dos baños, estudio, cocina integral, sala, comedor, pisos en madera, 2 parqueaderos en línea, deposito. ",660000000,Particular,122,122,Carrera 51 No 104b-38,"122,00 m2",3,2,16 a 30 años,5409836.07,3,535000,Pasadena,3,2,"Interiores$Calentador, Chimenea, Citófono, Cocina Integral, Depósito / Bodega, Estudio, Hall de Alcobas, Zona de lavandería|Exteriores$Ascensor, Garaje(s), Parqueadero Visitantes, Portería / Recepción, Salón Comunal, Vigilancia|del Sector$Supermercados / C.Comerciales, Trans. Público cercano, Zona Residencial",4.693900108337401,-74.0614700317383,1,True,1/19/2021 3:12:06 PM,https://www.fincaraiz.com.co/apartamento-en-venta/bogota/pasadena-det-5835331.aspx
249,YB Inmobiliaria,Venta,Apartamento,"ACOGEDOR Apartamento de 80 m²,  Sector EXCLUSIVO de PASADENA,  rodeado de parques,  EXCELENTE Ubicación y vías de ACCESO,  Barrio muy RECURSIVO consta de 2 Alcobas,  Cuarto Estudio y/o servicio,  3 Baños,  Sala Comedor,  Chimenea,  Balcones,  Cocina Integral mixta con estufa y calentador a Gas,  Zona de lavandería,  2 Garajes Cubiertos en Línea,  1 Depósito,  1 Ascensor,  EDIFICIO con elegante Recepción,  Salón social,  Bicicletero,  NEGOCIABLE.",430000000,Professional,80,80,Carrera 53  107-35,"80,00 m2",2,3,16 a 30 años,5375000.0,3,417000,Pasadena,3,2,"Interiores$Balcón, Chimenea, Citófono, Cocina Integral, Cuarto de Servicio, Depósito / Bodega, Estudio, Hall de Alcobas, Instalación de gas, Zona de lavandería|Exteriores$Ascensor, Circuito cerrado de TV, En conjunto cerrado, Portería / Recepción, Salón Comunal, Vigilancia|del Sector$Colegios / Universidades, Parques cercanos, Supermercados / C.Comerciales, Trans. Público cercano, Zona Residencial",4.69683980941772,-74.0627899169922,1,True,11/27/2020 1:07:06 AM,https://www.fincaraiz.com.co/apartamento-en-venta/bogota/pasadena-det-5889044.aspx
250,Mision Inmobiliaria & Zulma Sandoval Fincaraiz,Venta,Apartamento,"ZS-767 Hermoso apartamento para estrenar,  entrega inmediata con excelente iluminación. 3 habitaciones principal con baño privado,  zona social en un solo ambiente con chimenea a gas,  baño social,  balcón,  cocina integral abierta,  2 parqueaderos y deposito. Edificio cuenta con  lobby,  salón de entretenimiento,  salón de reuniones,  salón de juegos infantiles,  gimnasio,  terraza con Bbq,  terraza con parque infantil,  sendero de trote en terraza,  2 accesos vehiculares y un acceso peatonal,  12 parqueaderos de visitantes,  caldera,  .",895000000,Professional,125,125,calle 104A N°47A-14 Apto 404 ,"125,00 m2",3,3,1 a 8 años,7160000.0,4,0,Pasadena,4,2,"Interiores$Baño Auxiliar, Baño Independiente, Calentador, Chimenea, Cocina Integral, Depósito / Bodega|Exteriores$Asador, Ascensor, Garaje / Parqueadero(s), Garaje(s), Parqueadero Visitantes, Portería / Recepción, Terraza, Vigilancia",4.692348957061769,-74.0589828491211,1,True,2/10/2021 6:20:53 PM,https://www.fincaraiz.com.co/apartamento-en-venta/bogota/pasadena-det-5344507.aspx
251,IBONN CASTRO,Venta,Apartamento,"Excelente apartamento, con espectacular vista, buena iluminacion, alcoba amplia, baño privado vestier, salon comedor, cocina tipo americano, baño social, menos de un año de construido, para ver con cita previa.",410000000,Particular,57,57,Calle 106 Cra 48,"57,00 m2",1,2,Menos de 1 año,7192982.46,11,283000,Pasadena,11,1,"Interiores$Barra estilo americano, Calentador, Citófono, Cocina tipo Americano, Depósito / Bodega, Hall de Alcobas, Instalación de gas, Zona de lavandería|Exteriores$Ascensor, Parqueadero Visitantes, Portería / Recepción, Salón Comunal, Terraza, Vigilancia, Vista panorámica, Zona Infantil|del Sector$Parques cercanos, Supermercados / C.Comerciales, Trans. Público cercano, Zona Residencial",4.69414186477661,-74.05857849121091,1,True,1/10/2021 2:27:22 PM,https://www.fincaraiz.com.co/apartamento-en-venta/bogota/pasadena-det-5812422.aspx
252,K6brokersinmobiliarios,Venta,Apartamento,"Este penthouse dúplex tiene todo: vista,  luz,  grandes espacios,  comodidad y buena energía. Sala comedor con chimenea y ventanales increíbles! La cocina es abierta con espacio para comedor auxiliar,  lavandería,  cuarto y baño del servicio,  baño social en primer piso. El segundo tiene: hall de alcobas con vista,  alcoba principal con estudio,  walk-in closet y baño,  baño para las alcobas auxiliares. Dos garajes independientes,  depósito.  El edificio tiene parq. visitantes y terraza social..",860000000,Professional,153,153,Calle 106  45-39,,3,3,1 a 8 años,5603335.94,4,890000,Pasadena,4,2,"Interiores$Baño Auxiliar, Barra estilo americano, Calentador, Citófono, Cocina tipo Americano, Comedor auxiliar, Cuarto de Servicio, Depósito / Bodega, Estudio, Hall de Alcobas, Zona de lavandería|Exteriores$Ascensor, Circuito cerrado de TV, Garaje(s), Portería / Recepción, Terraza, Vigilancia, Vista panorámica|del Sector$Parques cercanos, Trans. Público cercano, Zona Residencial|#Apartamento#$Duplex",4.69391012191772,-74.0568771362305,1,True,11/10/2020 11:51:33 PM,https://www.fincaraiz.com.co/apartamento-en-venta/bogota/pasadena-det-5873147.aspx
253,Calpa,Venta,Apartamento,"Bonito apartamento interior,  con buena iluminación y ventilación. Esta ubicado a 3 calles de los 3 elefantes y Carulla..",400000000,Professional,70,70,carrera54-104a-26,"64,00 m2",2,2,9 a 15 años,5714285.71,3,432000,Pasadena,3,1,"Interiores$Balcón, Barra estilo americano, Calentador, Citófono, Cocina Integral, Cocina tipo Americano, Depósito / Bodega, Instalación de gas, Zona de lavandería|Exteriores$Ascensor, Circuito cerrado de TV, Garaje(s), Portería / Recepción, Vigilancia|del Sector$Colegios / Universidades, Parques cercanos, Supermercados / C.Comerciales, Trans. Público cercano, Zona Residencial",4.69348001480103,-74.0634002685547,1,True,11/5/2020 11:20:34 PM,https://www.fincaraiz.com.co/apartamento-en-venta/bogota/pasadena-det-5860048.aspx
254,Rentabien S.A.S,Venta,Apartamento,"Precioso apartamento,  ubicado en un exclusivo sector de la ciudad,  el apartamento consta de 3 amplias habitaciones cada una con su closet,  2 baños uno social y otro privado con división en vidrio templado,  Alcoba de servicio con baño.. Estudio. Sala amplia  con una preciosa chimenea ideal para los días fríos. Comedor independiente. 2 parqueaderos (1 cubierto,  1 descubierto) Cocina cerrada. Sin balcón,  sin ascensor,  110 mts,  administración $530.000 vigilancia 24 HRS7,  salón comunal,  sala de Star,  plazoleta. Interior con vista a la Av 50  1 apto por piso,  el edificio tiene 11 aptos en total. 25 años de antigüedad aprox..",450000000,Professional,110,110,Carrera 51 # 103B - 23 Apto 504 Edificio Flygsa,"95,00 m2",3,2,16 a 30 años,4090909.09,0,530000,Pasadena,0,2,"Interiores$Calentador, Citófono, Closet, Cocina Integral, Comedor, Cuarto de Servicio, Escalera de Emergencia, Estudio, Puerta de seguridad|Exteriores$Bahía exterior de parqueo, Garaje Cubierto, Portería / Vigilancia, Salón Comunal, Vigilancia privada 24*7|del Sector$Área Urbana, Colegios / Universidades, Parques cercanos, Sobre vía principal, Supermercados / C.Comerciales, Trans. Público cercano, Zona Residencial",4.69199991226196,-74.06199645996091,0,False,11/11/2020 11:08:02 PM,https://www.fincaraiz.com.co/apartamento-en-venta/bogota/pasadena-det-5876272.aspx
255,Fincaraiz Asociados,Venta,Apartamento,"Apto en venta de 98m2 en Pasadena. Piso 5. Exterior. Duplex. Sala- comedor integrados,  son espacios con excelente iluminación,  acogedores,  acompañados de una buena chimenea. La cocina abierta,  tipo americano con zona de lavandería. 4 Habitaciones o posibilidad de estudio. 2 baños. La Habitación ppal. piso 2,  es muy amplia,  cómoda y cuenta con una pequeña terraza que hace un espacio muy especial. 2 parqueaderos. Cerca de parques,  y zona comercial. Fácil movilidad,  acceso vehicular y peatonal..",450000000,Professional,98,98,carrera 50 103b 33,"99,00 m2",4,2,9 a 15 años,4568527.92,5,637000,Pasadena,5,2,"Interiores$Baño Auxiliar, Barra estilo americano, Calentador, Chimenea, Cocina tipo Americano, Comedor auxiliar, Estudio, Instalación de gas, Zona de lavandería|Exteriores$Ascensor, En conjunto cerrado, Garaje(s), Portería / Recepción, Salón Comunal, Terraza, Vigilancia|del Sector$Colegios / Universidades, Parques cercanos, Supermercados / C.Comerciales, Trans. Público cercano, Zona Residencial",4.69214010238647,-74.06117248535159,1,False,10/21/2020 4:01:40 PM,https://www.fincaraiz.com.co/apartamento-en-venta/bogota/pasadena-det-5819330.aspx
256,Luisa Medina,Venta,Apartamento,"Hermoso Apartamento en Pasadena 56mt,  Piso 2 interior iluminado,2 alcobas, 2 baños, Sala comedor Cocina integral con mesón en mármol, Chimenea Calentador y estufa con horno a gas, 1 parqueadero, Edificio de 10 años con ascensor vigilancia 24x7, citofonía y parqueadero de visitantes. Ubicación excelente en zona residencial y muy tranquila rodeada de hermosos parques, frente a estación de SITP y cerca de estación 106 y puentelargo.  Excelente oportunidad de inversión. Venta Directa",345000000,Particular,56,56,cra 53 106-59 ,"56,00 m2",2,2,1 a 8 años,6160714.29,2,385000,Pasadena,2,1,"Interiores$Baño Auxiliar, Calentador, Chimenea, Cocina Integral, Hall de Alcobas, Instalación de gas|Exteriores$Ascensor, Cuarto de Escoltas, En conjunto cerrado, Parqueadero Visitantes, Portería / Recepción, Vigilancia|del Sector$Colegios / Universidades, Parques cercanos, Supermercados / C.Comerciales, Trans. Público cercano, Zona Residencial",4.69295597076416,-74.0628662109375,1,False,1/22/2021 2:41:42 PM,https://www.fincaraiz.com.co/apartamento-en-venta/bogota/pasadena-det-5799023.aspx
257,A12 Inversiones Inmobiliarias,Venta,Apartamento,APTO EN VENTA PASADENA PISO 4 HAB 2 72M2 en Pasadena - Usaquén - Bogotá D.C. - Cundinamarca.,350000000,Professional,72,72,Pasadena,,2,2,9 a 15 años,4861111.11,4,450000,Pasadena,4,1,"Interiores$Baño Independiente, Chimenea, Citófono, Closet, Cocina Integral, Zona de lavandería|Exteriores$Acceso Pavimentado, Vigilancia|del Sector$Supermercados / C.Comerciales, Zona Residencial",0.0,0.0,0,False,11/4/2020 4:13:11 PM,https://www.fincaraiz.com.co/apartamento-en-venta/bogota/pasadena-det-5854824.aspx
258,Jaime Fajardo,Venta,Apartamento,Bonito grande luz natural acogedor 11 aptos en el edificio Alcoba de servicio con baño 2 parqueaderos Excelente ubicación cerca a 3 elefantes Iserra 100 autopista norte Venta directa Todo al día,450000000,Particular,110,110,carrera 51 No 123 b 23,"110,00 m2",3,2,,4090909.09,0,520000,Pasadena,0,2,"Interiores$Baño Auxiliar, Calentador, Chimenea, Cocina Integral, Cuarto de servicio, Estudio, Hall de Alcobas, Instalación de gas, Piso en Baldosa /  Mármol, Zona de lavandería|Exteriores$Cuarto de Escoltas, Garaje(s), Portería / Recepción, Salón Comunal, Vigilancia",4.69092893600464,-74.0609664916992,0,False,12/30/2020 3:17:08 PM,https://www.fincaraiz.com.co/apartamento-en-venta/bogota/pasadena-det-5787568.aspx
259,Engel & Volkers,Venta,Apartamento,"Edificio terminado en este año,  con la mejor ubicación y acabados; cuenta con gimnasio,  3 terrazas y 2 salones de entrenamiento. Al ingresar al apartamento encontramos a mano derecha amplia cocina abierta con accesorios y terminados de la mejor calidad. En la zona social encontramos sala-comedor,  balcón y chimenea. En el área privada tenemos un hall de alcobas,  baño de alcobas y 2 amplias habitaciones,  la principal con Walk in closet y baño en suite. Posee 2 parqueaderos y depósito..",745500000,Professional,105,105,Calle 104A #47A-06W-02K4UT,"105,00 m2",2,2,Menos de 1 año,7100000.0,0,450000,Pasadena,0,2,"Interiores$Balcón, Calentador, Chimenea, Citófono, Cocina tipo Americano, Escalera de Emergencia, Estudio, Instalación de gas, Rociadores de agua, Zona de BBQ|Exteriores$Ascensor, Caldera, Garaje Cubierto, Gimnasio, Parqueadero Visitantes, Planta Eléctrica, Portería / Vigilancia, Salón Comunal, Salón de Juegos, Vigilancia privada 24*7, Zona Infantil|del Sector$Cómodas vias de acceso, Parques cercanos, Supermercados / C.Comerciales, Trans. Público cercano, Zona Residencial",4.69199991226196,-74.0589981079102,1,False,11/5/2020 4:35:23 AM,https://www.fincaraiz.com.co/apartamento-en-venta/bogota/pasadena-det-5857054.aspx
260,BROKERS&CÎA,Venta,Apartamento,"Apartamento con muy buenos espacios en pasadena alcobas amplias zona social amplia chimenea funcional exterior totalmente iluminado edificio de ladrillo a la vista sobre carrera,  ascensor,  precio de oportunidad mayor información Brokers Y Cia.",330000000,Professional,80,80,Cra 51106-28,"80,00 m2",2,2,16 a 30 años,4125000.0,2,350000,Pasadena,2,1,"Interiores$Barra estilo americano, Calentador, Chimenea, Citófono, Cocina tipo Americano, Hall de Alcobas, Instalación de gas, Piso en Baldosa /  Mármol, Zona de lavandería|Exteriores$Ascensor, Circuito cerrado de TV, En conjunto cerrado, Jardín, Portería / Recepción, Vigilancia, Zona Infantil|del Sector$Colegios / Universidades, Supermercados / C.Comerciales, Trans. Público cercano, Zona Residencial",4.69467639923096,-74.06121826171879,1,False,10/22/2020 6:40:03 PM,https://www.fincaraiz.com.co/apartamento-en-venta/bogota/pasadena-det-5822763.aspx
261,Grupo Terranova,Venta,Apartamento,VENDO APARTAMENTO EN PASADENA DE 84 METROS en Pasadena - Suba - Bogotá D.C. - Cundinamarca.,590000000,Professional,84,84,Carrera 45A  # 106-08,"84,00 m2",2,2,1 a 8 años,7023809.52,3,460000,Pasadena,3,2,,4.69403457641602,-74.0569839477539,0,False,12/17/2020 1:57:48 PM,https://www.fincaraiz.com.co/apartamento-en-venta/bogota/pasadena-det-5769649.aspx
262,Gustavo  Rodriguez,Venta,Apartamento,"Magnifico apartamento en Pasadena, Duplex, con terraza,ultimo piso, inmejorable ubicación. Conozcalo            Ganga  Cel 312 557 4628  ",460000000,Particular,100,100,Carrera 52  106-33 ,"100,00 m2",3,3,16 a 30 años,4600000.0,4,0,Pasadena,4,1,,4.6976490020752,-74.0707702636719,0,False,2/5/2021 6:08:42 PM,https://www.fincaraiz.com.co/apartamento-en-venta/bogota/pasadena-det-5766061.aspx
263,Grupo Terranova,Venta,Apartamento,"Vendo apartamento en Pasadena de 50 metros,  piso 3o. exterior con Ascensor,  una habitación,  un baño,  cocina abierta,  zona de ropas independiente,  estrato 5,   un parqueadero,  un depósito,   7 años de construido,  pisos en madera,  CCTV,  Salon Social,  Terraza BBQ (vista panorámica),  parqueadero de visitantes.,  ubicado a una cuadra de la Autopista.  Para más opciones nos encuentra en Grupo Terranova Colombia. .",390000000,Professional,50,50,Carrera 45A  # 106-08,"50,00 m2",1,1,1 a 8 años,7800000.0,3,380000,Pasadena,3,1,,4.69403457641602,-74.0569839477539,0,False,12/17/2020 1:57:51 PM,https://www.fincaraiz.com.co/apartamento-en-venta/bogota/pasadena-det-5769675.aspx
264,F&M Gestion Empresarial SAS,Venta,Apartamento,"VENDO APARTAMENTO EN PASADENA,  78 MTRS PISOS LAMINADOS,  EXCELENTE UBICACIÓN,  CERCA A LA IGLESIA SANTO DOMINGO,  A SEIS MINUTOS DE LA AV SUBA ,  AUTOPISTA NORTE Y CALLE 100,  EL DIFICIO CUENTA CON ZONA PARA BICICLETEROS. .",390000000,Professional,78,78,KRA 51 No. 103 B-57,"78,00 m2",2,2,16 a 30 años,5000000.0,5,340000,Pasadena,5,0,"Interiores$Baño Auxiliar, Baño Independiente, Calentador, Citófono, Closet, Cocina Integral, Hall de Alcobas, Zona de lavandería|Exteriores$Acceso Pavimentado, Portería / Recepción, Vigilancia|del Sector$Trans. Público cercano, Zona Residencial",4.69223737716675,-74.0620193481445,0,False,10/15/2020 1:04:31 PM,https://www.fincaraiz.com.co/apartamento-en-venta/bogota/pasadena-det-5802727.aspx
265,Jimenez Nassar y Asociados SAS,Venta,Apartamento,"Apartamento remodelado cocinas y baños,  3 habitaciones,  3 baños,  sala comedor,  cocina independiente,  ultimo piso,  muy buena distribución y espacioso,  alcoba principal con baño,  sin ascensor,  parques comunes,  zona muy tranquila y arbolada..",450000000,Professional,115,115,CALLE 103 N 64-75,,3,3,Más de 30 años,3913043.48,4,400000,Pasadena,4,1,"Interiores$Citófono, Cocina Integral, Cuarto de Servicio, Instalación de gas|Exteriores$Portería / Recepción, Vigilancia, Zonas Verdes|del Sector$Parques cercanos, Supermercados / C.Comerciales|#Apartamento#$PentHouse",4.69123983383179,-74.0684432983398,0,False,9/29/2020 9:10:33 PM,https://www.fincaraiz.com.co/apartamento-en-venta/bogota/pasadena-det-5757642.aspx
